<?xml version="1.0" encoding="UTF-8" ?>
<xs:schema xmlns:xs="http://www.w3.org/2001/XMLSchema">
    <xs:element name="recetas">
        <xs:complexType>
            <xs:sequence>
                <xs:element name="receta" minOccurs="1" maxOccurs="unbounded">
                    <xs:complexType>
                        <xs:sequence>
                            <xs:element name="nombre" type="xs:string" minOccurs="1" maxOccurs="1"></xs:element>
                            <xs:element name="ingrediente" minOccurs="1" maxOccurs="unbounded" >
                                <xs:complexType>
                                    <xs:sequence>
                                        <xs:element name="nombre" type="xs:string"></xs:element>
                                        <xs:element name="cantidad" minOccurs="1" maxOccurs="1">
                                            <xs:complexType>
                                                <xs:simpleContent>
                                                    <xs:extension base="xs:string">
                                                        <xs:attribute name="medida" type="xs:string" use="required" />
                                                    </xs:extension>
                                                </xs:simpleContent>
                                            </xs:complexType>
                                        </xs:element>
                                    </xs:sequence>
                                </xs:complexType>
                            </xs:element>
                            <xs:element name="preparacion" minOccurs="1" maxOccurs="1">
                                <xs:complexType>
                                    <xs:simpleContent>
                                        <xs:extension base="xs:string">
                                            <xs:attribute name="dificultad" type="xs:string" use="required" />
                                            <xs:attribute name="horno_temperatura" type="xs:unsignedByte" use="optional" />
                                            <xs:attribute name="tiempo" type="xs:string" use="optional" />
                                        </xs:extension>
                                    </xs:simpleContent>
                                </xs:complexType>
                            </xs:element>
                        </xs:sequence>
                    </xs:complexType>
                </xs:element>
            </xs:sequence>
        </xs:complexType>
    </xs:element>
</xs:schema>